{
  "$schema": "https://json-schema.org/draft/2020-12/schema",
  "$id": "https://nonp.fr/schemas/profil-habillage.v2.schema.json",
  "title": "Profil d'habillage NONP",
  "description": "VERSION 2 — décision nº6 de l'ADR-0001, tranchée le 2026-08-28. Toutes les tailles sont relatives à la HAUTEUR vidéo, sauf les marges latérales (largeur).\n\nCE QUI CHANGE PAR RAPPORT À LA VERSION 1.\n\n1. UNE SEULE COMMANDE POUR LA LARGEUR DE LA COLONNE DE TEXTE : sous_titre.bandeau.marge_texte_pct_largeur, qui vaut dans LES DEUX modes de bandeau. Elle remplace deux champs supprimés : bandeau.espaces_lateraux (mode « ajuste ») et bandeau.marge_interieure_pct_largeur (mode « pleine-largeur »). Les espaces latéraux se comptaient en largeurs d'espace — donc en fraction de la taille de police, donc de la HAUTEUR — pour un retrait qui consomme de la LARGEUR ; mesuré à l'ADR, ce réglage ne produisait AUCUN effet visible sur toute sa course en 16:9, et coûtait 30 % de la largeur utile en 9:16.\n\nCORRESPONDANCE ARITHMÉTIQUE DEPUIS LA VERSION 1, pour un lecteur qui viendrait de là :\n  • mode « pleine-largeur » : marge_texte_pct_largeur = marge_interieure_pct_largeur. Exact, sans condition.\n  • mode « ajuste » : marge_texte_pct_largeur = 100 × (padding_px + espaces_lateraux × largeur_d_une_espace) / largeur_vidéo, calculé sur le format de référence 16:9 1920×1080 avec la police du profil. Pour le profil NONP (padding 1,9 %, 4 espaces, Arial 78 px) : 100 × (21 + 86,7) / 1920 = 5,61. C'est la valeur par défaut du champ, et celle qui laisse le 16:9 inchangé.\n\n2. LA LONGUEUR DE LIGNE CIBLE DEVIENT UN CHAMP : sous_titre.longueur_ligne_cible. Mesuré à l'ADR : c'est le seul réglage qui agisse sur TOUS les formats, et il n'avait pas de place au fichier. Absent, il se déduit de taille_pct_hauteur par la table des tailles nommées — ce que faisait la version 1, donc un profil converti rend à l'identique.\n\n3. LE RECADRAGE ROND ENTRE AU PROFIL : logo.recadre_en_cercle. Il change ce qui est GRAVÉ ; laissé hors du fichier, un profil partagé donnait un logo carré chez le destinataire sans que rien ne le dise.\n\nCE QUI NE CHANGE PAS : tous les autres champs, à l'identique. bandeau.padding_pct_hauteur redevient ce que sa description disait déjà — une marge purement VERTICALE ; en version 1 elle servait aussi de retrait horizontal.\n\nLA TAILLE NOMMÉE N'EST PAS UN CHAMP, et c'est délibéré : elle est entièrement déterminée par taille_pct_hauteur et longueur_ligne_cible. Un champ de plus permettrait à un profil de se contredire. C'est une commodité d'interface qui ÉCRIT ces deux valeurs, pas une contrainte de format.",
  "type": "object",
  "additionalProperties": false,
  "required": ["schema_version", "nom", "sous_titre"],
  "properties": {
    "schema_version": {
      "const": 2,
      "description": "Version du schéma. Obligatoire. La version 1 reste LUE et convertie automatiquement — voir la correspondance arithmétique en tête de ce fichier. Le prototype Python, lui, ne lit que la version 1 : c'est une asymétrie assumée (ADR-0001, décision nº5, tranchée le 2026-08-28), le prototype prenant sa retraite avec l'app native."
    },
    "nom": {
      "type": "string",
      "minLength": 1,
      "maxLength": 80,
      "description": "Nom affiché du profil (ex. « NONP », « Neutre », « Association X »)."
    },
    "logo": {
      "type": "object",
      "additionalProperties": false,
      "required": ["actif"],
      "description": "Incrustation d'un logo. Section entière optionnelle ; « actif: false » (ou section absente) = pas de logo. Le profil neutre livré par défaut a actif: false.",
      "properties": {
        "actif": { "type": "boolean", "default": false },
        "fichier": {
          "type": "string",
          "minLength": 1,
          "description": "Chemin du fichier image (absolu, ou relatif au fichier de profil). PNG à fond transparent conseillé."
        },
        "position": {
          "description": "Préréglage 4 coins, OU coordonnées libres où x_pct/y_pct désignent le CENTRE du logo en % de la largeur/hauteur. Dans l'app native, le placement libre se fait à la souris sur l'aperçu et s'enregistre sous cette forme relative.",
          "default": { "preset": "haut-gauche" },
          "oneOf": [
            {
              "type": "object",
              "additionalProperties": false,
              "required": ["preset"],
              "properties": {
                "preset": { "enum": ["haut-gauche", "haut-droit", "bas-gauche", "bas-droit"] }
              }
            },
            {
              "type": "object",
              "additionalProperties": false,
              "required": ["x_pct", "y_pct"],
              "properties": {
                "x_pct": { "type": "number", "minimum": 0, "maximum": 100 },
                "y_pct": { "type": "number", "minimum": 0, "maximum": 100 }
              }
            }
          ]
        },
        "taille_pct_hauteur": {
          "type": "number",
          "minimum": 1,
          "maximum": 50,
          "description": "Plus grande dimension du logo en % de la HAUTEUR vidéo, ratio préservé. NONP : 11.5."
        },
        "marge_pct_hauteur": {
          "type": "number",
          "minimum": 0,
          "maximum": 20,
          "description": "Marge aux bords, en % de la hauteur. Ne s'applique qu'aux préréglages de coin. NONP : 4.0."
        },
        "opacite": {
          "type": "number",
          "minimum": 0,
          "maximum": 1,
          "default": 1,
          "description": "1.0 = aucun filtre d'opacité ajouté (garantit l'iso-rendu du profil historique)."
        },
        "recadre_en_cercle": {
          "type": "boolean",
          "default": false,
          "description": "AJOUT v2. Recadre le logo en cercle au moment du rendu, sans écrire de fichier à côté de l'original. Le prototype fabriquait une image ronde (--make-logo) : le rond était une propriété du FICHIER. Ici c'est une instruction de rendu, donc une propriété du PROFIL — sans quoi un profil partagé donnerait un logo carré chez le destinataire sans que rien ne le dise."
        }
      }
    },
    "sous_titre": {
      "type": "object",
      "additionalProperties": false,
      "required": ["police", "taille_pct_hauteur", "couleur_texte"],
      "description": "Mise en forme des sous-titres incrustés. Ne modifie JAMAIS le texte : la resegmentation à la ponctuation reste confinée à l'incrustation.",
      "properties": {
        "police": {
          "type": "string",
          "minLength": 1,
          "description": "Nom d'une police installée. Absente = ERREUR EXPLICITE, jamais de substitution silencieuse. L'app native propose une liste courte de familles présentes sur tout Mac, pour qu'un profil partagé rende à l'identique chez le destinataire."
        },
        "taille_pct_hauteur": {
          "type": "number",
          "minimum": 1.5,
          "maximum": 12,
          "description": "Taille de police en % de la hauteur vidéo. Sous ~2,8 : avertissement lisibilité. NONP : 7.2."
        },
        "couleur_texte": { "$ref": "#/$defs/couleur" },
        "contour": {
          "type": "object",
          "additionalProperties": false,
          "required": ["couleur", "epaisseur_pct_hauteur"],
          "properties": {
            "couleur": { "$ref": "#/$defs/couleur" },
            "epaisseur_pct_hauteur": {
              "type": "number",
              "minimum": 0,
              "maximum": 3,
              "description": "Épaisseur du contour en % de la hauteur vidéo. 0 = pas de contour. NONP : 0.6."
            }
          }
        },
        "bandeau": {
          "type": "object",
          "additionalProperties": false,
          "required": ["actif"],
          "description": "Fond plein derrière le texte.",
          "properties": {
            "actif": { "type": "boolean", "default": false },
            "mode": {
              "enum": ["ajuste", "pleine-largeur"],
              "default": "ajuste",
              "description": "AJOUT 2026-08-23, conservé en v2. « ajuste » : le fond épouse la longueur de chaque ligne (comportement historique, conservé par défaut — préréglage « Bandeau coloré »). « pleine-largeur » : bande de largeur constante sur toute la vidéo, texte centré ; masque un sous-titre déjà incrusté dans la source et évite que la largeur saute d'une réplique à l'autre. Défaut du profil neutre livré avec l'app native."
            },
            "couleur": { "$ref": "#/$defs/couleur", "default": "#000000" },
            "opacite": { "type": "number", "minimum": 0, "maximum": 1, "default": 1 },
            "padding_pct_hauteur": {
              "type": "number",
              "minimum": 0,
              "maximum": 10,
              "default": 1.9,
              "description": "Marge intérieure VERTICALE du fond, en % de la hauteur. Purement verticale depuis la v2 : en v1 elle servait aussi de retrait horizontal, mêlée aux espaces latéraux. NONP : 1.9."
            },
            "marge_texte_pct_largeur": {
              "type": "number",
              "minimum": 0,
              "maximum": 40,
              "default": 5.61,
              "description": "AJOUT v2, et UNIQUE commande de la largeur de la colonne de texte — dans les DEUX modes de bandeau. Retrait du texte par rapport au bord de la bande, de chaque côté, en % de la LARGEUR vidéo. Remplace « espaces_lateraux » et « marge_interieure_pct_largeur », tous deux supprimés. Appliqué en pixels entiers, comme toute la géométrie du moteur. Défaut 5.61 : la valeur mesurée qui reproduit, sur le format de référence 16:9 1080p, le débord que « espaces_lateraux: 4 » produisait. Sans bandeau, aucun retrait — il n'y a pas de bord dont s'écarter. NONP : 5.61. Profil neutre : 3.0, la valeur que sa marge intérieure de v1 portait déjà."
            },
            "hauteur_fixe_lignes": {
              "type": "integer",
              "minimum": 0,
              "maximum": 4,
              "default": 0,
              "description": "AJOUT 2026-08-23, conservé en v2. 0 = hauteur automatique (le fond s'adapte au nombre de lignes affichées, comportement historique). 1 à 4 = hauteur constante correspondant à ce nombre de lignes, pour que la bande ne saute pas entre une réplique d'une ligne et une réplique de deux. Recommandé : même valeur que lignes_max."
            }
          }
        },
        "marge_basse_pct_hauteur": {
          "type": "number",
          "minimum": 0,
          "maximum": 30,
          "description": "Distance entre le bas de la vidéo et les sous-titres, en % de la hauteur. NONP : 7.2."
        },
        "marge_laterale_pct_largeur": {
          "type": "number",
          "minimum": 0,
          "maximum": 20,
          "default": 3.0,
          "description": "Marges gauche/droite du TEXTE, en % de la largeur vidéo. Sert aussi au calcul de la largeur de ligne pour la resegmentation. NONP : 3.0."
        },
        "longueur_ligne_cible": {
          "type": "integer",
          "minimum": 28,
          "maximum": 42,
          "description": "AJOUT v2. Longueur de ligne visée, en caractères (ADR-0001 §5 : « 32 à 42, jamais moins de 28 »). C'est elle qui contraint la taille de police : taille_pct_hauteur est un MAXIMUM, réduit tant que la cible n'est pas atteinte. Mesuré à l'ADR, c'est le SEUL réglage qui agisse sur tous les formats — d'où son entrée au schéma. Absent : déduit de taille_pct_hauteur par la table des tailles nommées (5.4 → 42, 6.3 → 37, 7.2 → 32, 8.4 → 28), ce qui reproduit le comportement de la version 1. NONP : 32.",
          "default": 32
        },
        "lignes_max": {
          "type": "integer",
          "minimum": 1,
          "maximum": 4,
          "default": 2,
          "description": "Nombre maximal de lignes affichées simultanément. 2 = norme de sous-titrage. La resegmentation réaffecte les minutages au prorata SANS toucher aucun mot."
        }
      }
    }
  },
  "$defs": {
    "couleur": {
      "type": "string",
      "pattern": "^#[0-9A-Fa-f]{6}$",
      "description": "Couleur #RRGGBB. L'opacité est toujours un champ séparé — pas d'alpha hexadécimal."
    }
  }
}
